{
  "$schema": "https://json-schema.org/draft/2020-12/schema",
  "$id": "https://schemas.commandlayer.org/schemas/v1.0.0/trust/permit/permit.receipt.schema.json",
  "title": "CLAS Trust Permit Receipt",
  "description": "A signed receipt proving that a permission was issued, refused, or revoked.",
  "type": "object",
  "additionalProperties": false,
  "required": [
    "version",
    "family",
    "verb",
    "receipt_id",
    "request",
    "permit_result",
    "ts",
    "metadata"
  ],
  "properties": {
    "version": {
      "const": "1.0.0"
    },
    "family": {
      "const": "trust"
    },
    "verb": {
      "const": "permit"
    },
    "receipt_id": {
      "type": "string",
      "minLength": 1
    },
    "request": {
      "$ref": "./permit.request.schema.json"
    },
    "permit_result": {
      "type": "object",
      "additionalProperties": false,
      "required": [
        "status"
      ],
      "properties": {
        "status": {
          "type": "string",
          "enum": [
            "permitted",
            "refused",
            "revoked",
            "expired"
          ]
        },
        "permit_id": {
          "type": "string"
        },
        "reason": {
          "type": "string"
        },
        "expires_at": {
          "type": "string",
          "format": "date-time"
        }
      }
    },
    "ts": {
      "type": "string",
      "format": "date-time"
    },
    "metadata": {
      "type": "object",
      "additionalProperties": false,
      "required": [
        "proof"
      ],
      "properties": {
        "proof": {
          "$ref": "../_shared/proof.schema.json"
        },
        "trace": {
          "$ref": "../_shared/trace.schema.json"
        }
      }
    }
  }
}
