{
  "version": "1.0.0",
  "family": "trust",
  "verb": "permit",
  "receipt_id": "rcpt-permit-20260510-0001",
  "request": {
    "version": "1.0.0",
    "family": "trust",
    "verb": "permit",
    "issuer": "runtime.commandlayer.eth",
    "principal": "agent:runtime/reconciler-04",
    "permission": {
      "action": "patch",
      "resource": {
        "type": "k8s_configmap",
        "id": "payments-runtime-config",
        "uri": "urn:k8s:prod-us-east-1:namespace/payments:configmap/payments-runtime-config"
      },
      "scope": "namespace:payments"
    },
    "conditions": {
      "expires_at": "2026-05-10T14:00:00Z",
      "ip_allowlist": [
        "10.42.0.0/16"
      ]
    },
    "context": {
      "environment": "prod-us-east-1",
      "policy_id": "policy.runtime.patch-configmap.v1",
      "tenant_id": "tenant-acme-prod",
      "request_id": "req-permit-20260510-0001",
      "correlation_id": "corr-ops-20260510-p5"
    }
  },
  "permit_result": {
    "status": "permitted",
    "permit_id": "permit-runtime-config-patch-20260510-01",
    "reason": "Emergency config patch approved under scoped policy.",
    "expires_at": "2026-05-11T14:00:00Z"
  },
  "ts": "2026-05-10T12:05:00Z",
  "metadata": {
    "proof": {
      "canonicalization": "json.sorted_keys.v1",
      "hash": {
        "alg": "SHA-256",
        "value": "aaaaaaaaaaaaaaaaaaaaaaaaaaaaaaaaaaaaaaaaaaaaaaaaaaaaaaaaaaaaaaaa"
      },
      "signature": {
        "alg": "Ed25519",
        "value": "ed25519:demo:9f7c4d1ab3e6c8d14f2a98b7c3d5e1f09a8b7c6d5e4f3029182736455aabbccd",
        "kid": "cl-key-1"
      }
    }
  }
}
